{
  "id": "giac.gcia",
  "vendor": {
    "slug": "giac",
    "name": "GIAC",
    "url": "https://www.giac.org/"
  },
  "name": "GIAC Certified Intrusion Analyst",
  "abbr": "GCIA",
  "domain": "network-defense",
  "secondary_domains": [
    "incident-forensics",
    "threat-intel"
  ],
  "japan_only": false,
  "official": {
    "exam_url": "https://www.giac.org/certifications/certified-intrusion-analyst-gcia/",
    "fetched_at": "2026-05-02"
  },
  "logistics": {
    "cost_usd": 999,
    "format": "Open-book proctored, includes CyberLive packet-analysis tasks",
    "duration_min": 240,
    "questions": 106,
    "languages": [
      "en"
    ],
    "renewal_years": 4,
    "ce_required": true
  },
  "prerequisites": {
    "formal": [],
    "experience_years": 3,
    "recommended_certs": [
      "comptia.network-plus",
      "giac.gsec"
    ]
  },
  "scoring_factors": {
    "plus": [
      {
        "code": "DOD_8140_BASELINE",
        "weight_hint": "high",
        "evidence": "https://public.cyber.mil/wid/dod8140/"
      },
      {
        "code": "ANSI_ISO_17024_ACCREDITED",
        "weight_hint": "high"
      },
      {
        "code": "DEEP_PACKET_ANALYSIS",
        "weight_hint": "high"
      }
    ],
    "minus": [
      {
        "code": "EXPENSIVE_BUNDLE",
        "weight_hint": "medium"
      },
      {
        "code": "PERIMETER_PARADIGM_AGING",
        "weight_hint": "low"
      }
    ]
  },
  "third_party_evaluations": [
    {
      "source_id": "dod-8140",
      "level_hint": "professional",
      "url": "https://public.cyber.mil/wid/dod8140/",
      "fetched_at": "2026-05-02"
    },
    {
      "source_id": "nist-nice",
      "level_hint": "professional",
      "url": "https://www.nist.gov/itl/applied-cybersecurity/nice/nice-framework-resource-center",
      "fetched_at": "2026-05-02"
    }
  ],
  "sources": [
    {
      "type": "official",
      "url": "https://www.giac.org/certifications/certified-intrusion-analyst-gcia/"
    },
    {
      "type": "regulator",
      "url": "https://public.cyber.mil/wid/dod8140/"
    }
  ],
  "evaluation": {
    "computed_tier": "professional",
    "computed_at": "2026-05-02T06:09:52Z",
    "computed_by_skill": "evaluate-roadmap-3-personas@1",
    "rationale": "All three personas agree at this tier; rationale reflects consensus.",
    "persona_scores": {
      "hiroshi-tanaka": {
        "tier": "professional",
        "rationale": "Deep packet analysis valued in JP MSS work."
      },
      "maria-okonkwo": {
        "tier": "professional",
        "rationale": "DoD 8140 baseline; CyberLive packet tasks."
      },
      "alex-novak": {
        "tier": "professional",
        "rationale": "Deep packet analysis is technical depth."
      }
    }
  },
  "schema_version": 1
}
