{
  "id": "paloalto.security-operations-analyst",
  "vendor": {
    "slug": "paloalto",
    "name": "Palo Alto Networks",
    "url": "https://www.paloaltonetworks.com/"
  },
  "name": "Palo Alto Networks Certified Security Operations Analyst",
  "abbr": "PAN SecOps",
  "domain": "incident-forensics",
  "secondary_domains": [],
  "japan_only": false,
  "official": {
    "exam_url": "https://www.paloaltonetworks.com/services/education/certification",
    "fetched_at": "2026-05-02"
  },
  "logistics": {
    "cost_usd": 200,
    "format": "Proctored exam"
  },
  "prerequisites": {
    "formal": [],
    "experience_years": 2,
    "recommended_certs": []
  },
  "scoring_factors": {
    "plus": [
      {
        "code": "PEARSON_VUE_PROCTORED",
        "weight_hint": "medium",
        "evidence": "https://www.pearsonvue.com/us/en/paloaltonetworks.html"
      },
      {
        "code": "VENDOR_SOURCE_OF_TRUTH",
        "weight_hint": "high"
      },
      {
        "code": "PRODUCTION_RELEVANCE_HIRING",
        "weight_hint": "medium"
      }
    ],
    "minus": [
      {
        "code": "VENDOR_SPECIFIC_NOT_PORTABLE",
        "weight_hint": "medium"
      }
    ]
  },
  "third_party_evaluations": [
    {
      "source_id": "pearsonvue-paloalto",
      "level_hint": "professional",
      "url": "https://www.pearsonvue.com/us/en/paloaltonetworks.html",
      "fetched_at": "2026-05-02",
      "summary": "Cortex XSIAM/XDR/XSOAR analyst exam covering SOC triage, investigation, and automated response."
    }
  ],
  "sources": [
    {
      "type": "official",
      "url": "https://www.paloaltonetworks.com/services/education/certification"
    },
    {
      "type": "third_party",
      "url": "https://www.pearsonvue.com/us/en/paloaltonetworks.html"
    }
  ],
  "evaluation": {
    "computed_tier": "professional",
    "computed_at": "2026-05-02T06:09:52Z",
    "computed_by_skill": "evaluate-roadmap-3-personas@1",
    "rationale": "All three personas agree at this tier; rationale reflects consensus.",
    "persona_scores": {
      "hiroshi-tanaka": {
        "tier": "professional",
        "rationale": "Auto-derived from third-party evaluations (professional); pending differentiated human persona review."
      },
      "maria-okonkwo": {
        "tier": "professional",
        "rationale": "Auto-derived from third-party evaluations (professional); pending differentiated human persona review."
      },
      "alex-novak": {
        "tier": "professional",
        "rationale": "Auto-derived from third-party evaluations (professional); pending differentiated human persona review."
      }
    }
  },
  "schema_version": 1
}
