{
  "id": "microsoft.az-900",
  "vendor": {
    "slug": "microsoft",
    "name": "Microsoft",
    "url": "https://learn.microsoft.com/credentials/"
  },
  "name": "Microsoft Certified: Azure Fundamentals (AZ-900)",
  "abbr": "AZ-900",
  "domain": "cloud-security",
  "secondary_domains": [
    "governance-risk"
  ],
  "japan_only": false,
  "official": {
    "exam_url": "https://learn.microsoft.com/credentials/certifications/azure-fundamentals/",
    "fetched_at": "2026-05-02"
  },
  "logistics": {
    "cost_usd": 99,
    "format": "Proctored exam"
  },
  "prerequisites": {
    "formal": [],
    "experience_years": 0,
    "recommended_certs": []
  },
  "scoring_factors": {
    "plus": [
      {
        "code": "PEARSON_VUE_PROCTORED",
        "weight_hint": "medium",
        "evidence": "https://www.pearsonvue.com/us/en/microsoft.html"
      },
      {
        "code": "VENDOR_SOURCE_OF_TRUTH",
        "weight_hint": "high"
      },
      {
        "code": "MODERN_ATTACK_SURFACE",
        "weight_hint": "medium"
      }
    ],
    "minus": [
      {
        "code": "VENDOR_SPECIFIC_NOT_PORTABLE",
        "weight_hint": "medium"
      },
      {
        "code": "ENTRY_LEVEL_LIMITED_HIRING_SIGNAL",
        "weight_hint": "medium"
      }
    ]
  },
  "third_party_evaluations": [
    {
      "source_id": "pearsonvue-microsoft",
      "level_hint": "foundational",
      "url": "https://www.pearsonvue.com/us/en/microsoft.html",
      "fetched_at": "2026-05-02",
      "summary": "Foundational understanding of Azure cloud services, pricing, and security."
    }
  ],
  "sources": [
    {
      "type": "official",
      "url": "https://learn.microsoft.com/credentials/certifications/azure-fundamentals/"
    },
    {
      "type": "third_party",
      "url": "https://www.pearsonvue.com/us/en/microsoft.html"
    }
  ],
  "evaluation": {
    "computed_tier": "foundational",
    "computed_at": "2026-05-02T06:09:52Z",
    "computed_by_skill": "evaluate-roadmap-3-personas@1",
    "rationale": "All three personas agree at this tier; rationale reflects consensus.",
    "persona_scores": {
      "hiroshi-tanaka": {
        "tier": "foundational",
        "rationale": "Auto-derived from third-party evaluations (foundational); pending differentiated human persona review."
      },
      "maria-okonkwo": {
        "tier": "foundational",
        "rationale": "Auto-derived from third-party evaluations (foundational); pending differentiated human persona review."
      },
      "alex-novak": {
        "tier": "foundational",
        "rationale": "Auto-derived from third-party evaluations (foundational); pending differentiated human persona review."
      }
    }
  },
  "schema_version": 1
}
