{
  "id": "exemplar-global.iso27001-la",
  "vendor": {
    "slug": "exemplar-global",
    "name": "Exemplar Global",
    "url": "https://exemplarglobal.org/"
  },
  "name": "Certified ISMS Lead Auditor (Exemplar Global)",
  "abbr": "EG-ISMS-LA",
  "domain": "governance-risk",
  "secondary_domains": [],
  "japan_only": false,
  "official": {
    "exam_url": "https://exemplarglobal.org/certification/information-security-management-system-auditor-iso-27001/",
    "fetched_at": "2026-05-02"
  },
  "logistics": {
    "cost_usd": 1800,
    "format": "Proctored exam"
  },
  "prerequisites": {
    "formal": [],
    "experience_years": 3,
    "recommended_certs": []
  },
  "scoring_factors": {
    "plus": [
      {
        "code": "ANSI_OR_ISO_17024_ACCREDITED",
        "weight_hint": "high",
        "evidence": "https://www.ansi.org/"
      },
      {
        "code": "ISO_17024_ACCREDITED_PERSONNEL_SCHEME",
        "weight_hint": "high"
      },
      {
        "code": "GLOBAL_ISMS_BCMS_PIMS_AUDIT_DEMAND",
        "weight_hint": "high"
      }
    ],
    "minus": [
      {
        "code": "GENERAL_LIMITATIONS",
        "weight_hint": "low"
      }
    ]
  },
  "third_party_evaluations": [
    {
      "source_id": "ansi",
      "level_hint": "professional",
      "url": "https://www.ansi.org/",
      "fetched_at": "2026-05-02",
      "summary": "Exemplar Global TPECS-based ISO 27001:2022 Lead Auditor; ANSI-accredited under ISO/IEC 17024."
    }
  ],
  "sources": [
    {
      "type": "official",
      "url": "https://exemplarglobal.org/certification/information-security-management-system-auditor-iso-27001/"
    },
    {
      "type": "third_party",
      "url": "https://www.ansi.org/"
    }
  ],
  "evaluation": {
    "computed_tier": "professional",
    "computed_at": "2026-05-02T06:09:52Z",
    "computed_by_skill": "evaluate-roadmap-3-personas@1",
    "rationale": "All three personas agree at this tier; rationale reflects consensus.",
    "persona_scores": {
      "hiroshi-tanaka": {
        "tier": "professional",
        "rationale": "Auto-derived from third-party evaluations (professional); pending differentiated human persona review."
      },
      "maria-okonkwo": {
        "tier": "professional",
        "rationale": "Auto-derived from third-party evaluations (professional); pending differentiated human persona review."
      },
      "alex-novak": {
        "tier": "professional",
        "rationale": "Auto-derived from third-party evaluations (professional); pending differentiated human persona review."
      }
    }
  },
  "schema_version": 1
}
