{
  "id": "mirantis.dca",
  "vendor": {
    "slug": "mirantis",
    "name": "Mirantis",
    "url": "https://www.mirantis.com/"
  },
  "name": "Docker Certified Associate",
  "abbr": "DCA",
  "name_ja": "Docker認定アソシエイト",
  "domain": "cloud-security",
  "secondary_domains": [
    "endpoint-mobile",
    "application-appsec"
  ],
  "japan_only": false,
  "availability": "available",
  "official": {
    "exam_url": "https://training.mirantis.com/dca-certification-exam/",
    "fetched_at": "2026-05-02"
  },
  "logistics": {
    "cost_usd": 199,
    "format": "Remote-proctored exam delivered via Zoom on Windows or macOS; 13 multiple-choice + 42 discrete-option multiple-choice (DOMC) questions",
    "duration_min": 90,
    "questions": 55,
    "languages": [
      "en"
    ],
    "renewal_years": 2,
    "ce_required": false
  },
  "prerequisites": {
    "formal": [
      "Recommended: 6-12 months of hands-on Docker experience"
    ],
    "experience_years": 1,
    "recommended_certs": []
  },
  "scoring_factors": {
    "plus": [
      {
        "code": "WIDELY_RECOGNIZED_VENDOR",
        "weight_hint": "medium"
      },
      {
        "code": "AFFORDABLE_EXAM",
        "weight_hint": "medium"
      },
      {
        "code": "CONTAINER_ECOSYSTEM_RELEVANCE",
        "weight_hint": "medium"
      }
    ],
    "minus": [
      {
        "code": "MULTIPLE_CHOICE_ONLY",
        "weight_hint": "medium"
      },
      {
        "code": "VENDOR_ONLY_RECOGNITION",
        "weight_hint": "medium"
      },
      {
        "code": "FOCUSES_ON_GENERAL_INFRASTRUCTURE",
        "weight_hint": "medium"
      },
      {
        "code": "ENGLISH_ONLY",
        "weight_hint": "low"
      },
      {
        "code": "OVERTAKEN_BY_KUBERNETES_CERTS",
        "weight_hint": "medium"
      }
    ]
  },
  "sources": [
    {
      "type": "official",
      "url": "https://training.mirantis.com/dca-certification-exam/"
    },
    {
      "type": "third_party",
      "url": "https://pauljerimy.com/security-certification-roadmap/",
      "use": "inspiration_only"
    }
  ],
  "evaluation": {
    "computed_tier": "foundational",
    "computed_at": "2026-05-02T08:04:20Z",
    "computed_by_skill": "evaluate-roadmap-3-personas@1",
    "rationale": "All three personas agree at this tier; rationale reflects consensus.",
    "persona_scores": {
      "hiroshi-tanaka": {
        "tier": "foundational",
        "rationale": "Auto-derived from cert name + scoring_factors heuristic (no third-party level hints available); pending differentiated human persona review."
      },
      "maria-okonkwo": {
        "tier": "foundational",
        "rationale": "Auto-derived from cert name + scoring_factors heuristic (no third-party level hints available); pending differentiated human persona review."
      },
      "alex-novak": {
        "tier": "foundational",
        "rationale": "Auto-derived from cert name + scoring_factors heuristic (no third-party level hints available); pending differentiated human persona review."
      }
    }
  },
  "schema_version": 1
}
