{
  "id": "cncf.ckad",
  "vendor": {
    "slug": "cncf",
    "name": "Cloud Native Computing Foundation",
    "url": "https://www.cncf.io/training/certification/"
  },
  "name": "Certified Kubernetes Application Developer",
  "abbr": "CKAD",
  "name_ja": "認定 Kubernetes アプリケーション開発者",
  "domain": "cloud-security",
  "secondary_domains": [
    "application-appsec",
    "endpoint-mobile"
  ],
  "japan_only": false,
  "availability": "available",
  "official": {
    "exam_url": "https://www.cncf.io/training/certification/ckad/",
    "fetched_at": "2026-05-02"
  },
  "logistics": {
    "cost_usd": 445,
    "format": "Online proctored, performance-based command-line tasks deploying and configuring workloads on Kubernetes",
    "duration_min": 120,
    "languages": [
      "en",
      "ja",
      "zh-Hans"
    ],
    "renewal_years": 2,
    "ce_required": false
  },
  "prerequisites": {
    "formal": [
      "Working knowledge of container runtimes and microservice architecture",
      "Familiarity with OCI-compliant container images and Kubernetes resource definitions"
    ],
    "experience_years": 1,
    "recommended_certs": []
  },
  "scoring_factors": {
    "plus": [
      {
        "code": "HANDS_ON_PRACTICAL",
        "weight_hint": "high"
      },
      {
        "code": "PERFORMANCE_BASED_EXAM",
        "weight_hint": "high"
      },
      {
        "code": "OPEN_BOOK_REAL_WORLD",
        "weight_hint": "medium"
      },
      {
        "code": "INDUSTRY_STANDARD",
        "weight_hint": "high"
      },
      {
        "code": "JAPANESE_LANGUAGE_AVAILABLE",
        "weight_hint": "low"
      }
    ],
    "minus": [
      {
        "code": "FOCUSES_ON_GENERAL_INFRASTRUCTURE",
        "weight_hint": "medium"
      },
      {
        "code": "FREQUENT_VERSION_CHURN",
        "weight_hint": "low"
      }
    ]
  },
  "sources": [
    {
      "type": "official",
      "url": "https://www.cncf.io/training/certification/ckad/"
    },
    {
      "type": "third_party",
      "url": "https://pauljerimy.com/security-certification-roadmap/",
      "use": "inspiration_only"
    }
  ],
  "evaluation": {
    "computed_tier": "professional",
    "computed_at": "2026-05-02T08:04:20Z",
    "computed_by_skill": "evaluate-roadmap-3-personas@1",
    "rationale": "All three personas agree at this tier; rationale reflects consensus.",
    "persona_scores": {
      "hiroshi-tanaka": {
        "tier": "professional",
        "rationale": "Auto-derived from cert name + scoring_factors heuristic (no third-party level hints available); pending differentiated human persona review."
      },
      "maria-okonkwo": {
        "tier": "professional",
        "rationale": "Auto-derived from cert name + scoring_factors heuristic (no third-party level hints available); pending differentiated human persona review."
      },
      "alex-novak": {
        "tier": "professional",
        "rationale": "Auto-derived from cert name + scoring_factors heuristic (no third-party level hints available); pending differentiated human persona review."
      }
    }
  },
  "schema_version": 1
}
