{
  "id": "jipdec.pmark-auditor",
  "vendor": {
    "slug": "jipdec",
    "name": "JIPDEC (Japan Institute for Promotion of Digital Economy and Community)",
    "url": "https://www.jipdec.or.jp/eng/"
  },
  "name": "Privacy Mark Assistant Auditor",
  "abbr": "PMARK-AA",
  "domain": "privacy-data-protection",
  "secondary_domains": [],
  "japan_only": true,
  "official": {
    "exam_url": "https://privacymark.jp/system/institution/judge/about.html",
    "fetched_at": "2026-05-02"
  },
  "logistics": {
    "cost_usd": 1500,
    "format": "Proctored exam"
  },
  "prerequisites": {
    "formal": [],
    "experience_years": 3,
    "recommended_certs": [
      "jipdec.isms-internal-auditor"
    ]
  },
  "scoring_factors": {
    "plus": [
      {
        "code": "JP_NATIONAL_OR_INDUSTRY_RECOGNITION",
        "weight_hint": "high"
      }
    ],
    "minus": [
      {
        "code": "JAPAN_LOCAL_RECOGNITION_ONLY",
        "weight_hint": "high"
      }
    ]
  },
  "third_party_evaluations": [
    {
      "source_id": "ppc-jp",
      "level_hint": "professional",
      "url": "https://www.ppc.go.jp/en/",
      "fetched_at": "2026-05-02",
      "summary": "JIPDEC-registered auditor for Japan's Privacy Mark (JIS Q 15001) scheme."
    }
  ],
  "sources": [
    {
      "type": "official",
      "url": "https://privacymark.jp/system/institution/judge/about.html"
    },
    {
      "type": "third_party",
      "url": "https://www.ppc.go.jp/en/"
    }
  ],
  "evaluation": {
    "computed_tier": "professional",
    "computed_at": "2026-05-02T06:09:52Z",
    "computed_by_skill": "evaluate-roadmap-3-personas@1",
    "rationale": "All three personas agree at this tier; rationale reflects consensus.",
    "persona_scores": {
      "hiroshi-tanaka": {
        "tier": "professional",
        "rationale": "Auto-derived from third-party evaluations (professional); pending differentiated human persona review."
      },
      "maria-okonkwo": {
        "tier": "professional",
        "rationale": "Auto-derived from third-party evaluations (professional); pending differentiated human persona review."
      },
      "alex-novak": {
        "tier": "professional",
        "rationale": "Auto-derived from third-party evaluations (professional); pending differentiated human persona review."
      }
    }
  },
  "schema_version": 1,
  "name_ja": "プライバシーマーク審査員補"
}
