{
  "id": "google.pmle",
  "vendor": {
    "slug": "google",
    "name": "Google Cloud",
    "url": "https://cloud.google.com/learn/certification"
  },
  "name": "Google Cloud Professional Machine Learning Engineer",
  "abbr": "PMLE",
  "domain": "application-appsec",
  "secondary_domains": [
    "privacy-data-protection",
    "cloud-security"
  ],
  "japan_only": false,
  "official": {
    "exam_url": "https://cloud.google.com/learn/certification/machine-learning-engineer",
    "fetched_at": "2026-05-02"
  },
  "logistics": {
    "cost_usd": 200,
    "format": "Proctored exam"
  },
  "prerequisites": {
    "formal": [],
    "experience_years": 3,
    "recommended_certs": [
      "google.ace"
    ]
  },
  "scoring_factors": {
    "plus": [
      {
        "code": "PEARSON_VUE_PROCTORED",
        "weight_hint": "medium",
        "evidence": "https://googlecloudexamstore.pearsonvue.com/"
      },
      {
        "code": "VENDOR_SOURCE_OF_TRUTH",
        "weight_hint": "high"
      },
      {
        "code": "MODERN_ATTACK_SURFACE",
        "weight_hint": "medium"
      }
    ],
    "minus": [
      {
        "code": "VENDOR_SPECIFIC_NOT_PORTABLE",
        "weight_hint": "medium"
      }
    ]
  },
  "third_party_evaluations": [
    {
      "source_id": "pearsonvue-google",
      "level_hint": "professional",
      "url": "https://googlecloudexamstore.pearsonvue.com/",
      "fetched_at": "2026-05-02",
      "summary": "Designs, builds, and productionizes ML models on Google Cloud."
    }
  ],
  "sources": [
    {
      "type": "official",
      "url": "https://cloud.google.com/learn/certification/machine-learning-engineer"
    },
    {
      "type": "third_party",
      "url": "https://googlecloudexamstore.pearsonvue.com/"
    }
  ],
  "evaluation": {
    "computed_tier": "professional",
    "computed_at": "2026-05-02T06:09:52Z",
    "computed_by_skill": "evaluate-roadmap-3-personas@1",
    "rationale": "All three personas agree at this tier; rationale reflects consensus.",
    "persona_scores": {
      "hiroshi-tanaka": {
        "tier": "professional",
        "rationale": "Auto-derived from third-party evaluations (professional); pending differentiated human persona review."
      },
      "maria-okonkwo": {
        "tier": "professional",
        "rationale": "Auto-derived from third-party evaluations (professional); pending differentiated human persona review."
      },
      "alex-novak": {
        "tier": "professional",
        "rationale": "Auto-derived from third-party evaluations (professional); pending differentiated human persona review."
      }
    }
  },
  "schema_version": 1
}
