{
  "id": "fortinet.nse4-fortios-admin",
  "vendor": {
    "slug": "fortinet",
    "name": "Fortinet",
    "url": "https://www.fortinet.com/"
  },
  "name": "NSE 4 - FortiOS Administrator",
  "abbr": "NSE 4",
  "domain": "network-defense",
  "secondary_domains": [],
  "japan_only": false,
  "official": {
    "exam_url": "https://training.fortinet.com/local/staticpage/view.php?page=fortios_administrator_exam",
    "fetched_at": "2026-05-02"
  },
  "logistics": {
    "cost_usd": 400,
    "format": "Proctored exam"
  },
  "prerequisites": {
    "formal": [],
    "experience_years": 1,
    "recommended_certs": []
  },
  "scoring_factors": {
    "plus": [
      {
        "code": "PEARSON_VUE_PROCTORED",
        "weight_hint": "medium",
        "evidence": "https://www.pearsonvue.com/us/en/fortinet.html"
      },
      {
        "code": "VENDOR_SOURCE_OF_TRUTH",
        "weight_hint": "high"
      },
      {
        "code": "PRODUCTION_RELEVANCE_HIRING",
        "weight_hint": "medium"
      }
    ],
    "minus": [
      {
        "code": "VENDOR_SPECIFIC_NOT_PORTABLE",
        "weight_hint": "medium"
      }
    ]
  },
  "third_party_evaluations": [
    {
      "source_id": "pearsonvue-fortinet",
      "level_hint": "associate",
      "url": "https://www.pearsonvue.com/us/en/fortinet.html",
      "fetched_at": "2026-05-02",
      "summary": "FortiGate day-to-day admin: policies, NAT, VPN, SD-WAN, FortiGuard services and HA."
    }
  ],
  "sources": [
    {
      "type": "official",
      "url": "https://training.fortinet.com/local/staticpage/view.php?page=fortios_administrator_exam"
    },
    {
      "type": "third_party",
      "url": "https://www.pearsonvue.com/us/en/fortinet.html"
    }
  ],
  "evaluation": {
    "computed_tier": "associate",
    "computed_at": "2026-05-02T14:04:04Z",
    "computed_by_skill": "evaluate-roadmap-3-personas@1",
    "rationale": "All three personas agree at this tier; rationale reflects consensus.",
    "persona_scores": {
      "hiroshi-tanaka": {
        "tier": "associate",
        "rationale": "Auto-derived from third-party evaluations (associate); pending differentiated human persona review."
      },
      "maria-okonkwo": {
        "tier": "associate",
        "rationale": "Auto-derived from third-party evaluations (associate); pending differentiated human persona review."
      },
      "alex-novak": {
        "tier": "associate",
        "rationale": "Auto-derived from third-party evaluations (associate); pending differentiated human persona review."
      }
    }
  },
  "schema_version": 1
}
