{
  "id": "hackthebox.cpts",
  "vendor": {
    "slug": "hackthebox",
    "name": "Hack The Box",
    "url": "https://www.hackthebox.com/"
  },
  "name": "HTB Certified Penetration Testing Specialist",
  "abbr": "HTB CPTS",
  "domain": "offensive-redteam",
  "secondary_domains": [],
  "japan_only": false,
  "official": {
    "exam_url": "https://academy.hackthebox.com/preview/certifications/htb-certified-penetration-testing-specialist",
    "fetched_at": "2026-05-02"
  },
  "logistics": {
    "cost_usd": 210,
    "format": "Proctored exam"
  },
  "prerequisites": {
    "formal": [],
    "experience_years": 2,
    "recommended_certs": []
  },
  "scoring_factors": {
    "plus": [
      {
        "code": "DHS_CISA_NICCS_LISTED",
        "weight_hint": "medium",
        "evidence": "https://niccs.cisa.gov/training/catalog/ata/hack-box-certified-penetration-testing-specialist-htb-cpts"
      },
      {
        "code": "FULLY_HANDS_ON_PRACTICAL",
        "weight_hint": "high"
      },
      {
        "code": "MODERN_OFFENSIVE_FOCUS",
        "weight_hint": "high"
      }
    ],
    "minus": [
      {
        "code": "GENERAL_LIMITATIONS",
        "weight_hint": "low"
      }
    ]
  },
  "third_party_evaluations": [
    {
      "source_id": "niccs",
      "level_hint": "professional",
      "url": "https://niccs.cisa.gov/training/catalog/ata/hack-box-certified-penetration-testing-specialist-htb-cpts",
      "fetched_at": "2026-05-02",
      "summary": "End-to-end pentest exam: external recon, AD pivoting, web, privesc, professional report."
    }
  ],
  "sources": [
    {
      "type": "official",
      "url": "https://academy.hackthebox.com/preview/certifications/htb-certified-penetration-testing-specialist"
    },
    {
      "type": "third_party",
      "url": "https://niccs.cisa.gov/training/catalog/ata/hack-box-certified-penetration-testing-specialist-htb-cpts"
    }
  ],
  "evaluation": {
    "computed_tier": "professional",
    "computed_at": "2026-05-02T06:09:52Z",
    "computed_by_skill": "evaluate-roadmap-3-personas@1",
    "rationale": "All three personas agree at this tier; rationale reflects consensus.",
    "persona_scores": {
      "hiroshi-tanaka": {
        "tier": "professional",
        "rationale": "Auto-derived from third-party evaluations (professional); pending differentiated human persona review."
      },
      "maria-okonkwo": {
        "tier": "professional",
        "rationale": "Auto-derived from third-party evaluations (professional); pending differentiated human persona review."
      },
      "alex-novak": {
        "tier": "professional",
        "rationale": "Auto-derived from third-party evaluations (professional); pending differentiated human persona review."
      }
    }
  },
  "schema_version": 1
}
