{
  "id": "hackthebox.cbbh",
  "vendor": {
    "slug": "hackthebox",
    "name": "Hack The Box",
    "url": "https://www.hackthebox.com/"
  },
  "name": "HTB Certified Bug Bounty Hunter",
  "abbr": "HTB CBBH",
  "domain": "application-appsec",
  "secondary_domains": [],
  "japan_only": false,
  "official": {
    "exam_url": "https://academy.hackthebox.com/preview/certifications/htb-certified-bug-bounty-hunter",
    "fetched_at": "2026-05-02"
  },
  "logistics": {
    "cost_usd": 210,
    "format": "Proctored exam"
  },
  "prerequisites": {
    "formal": [],
    "experience_years": 1,
    "recommended_certs": []
  },
  "scoring_factors": {
    "plus": [
      {
        "code": "DHS_CISA_NICCS_LISTED",
        "weight_hint": "medium",
        "evidence": "https://niccs.cisa.gov/training/catalog/htb"
      },
      {
        "code": "FULLY_HANDS_ON_PRACTICAL",
        "weight_hint": "high"
      },
      {
        "code": "MODERN_OFFENSIVE_FOCUS",
        "weight_hint": "high"
      }
    ],
    "minus": [
      {
        "code": "NEWER_BRAND_LIMITED_HIRING_RECOGNITION",
        "weight_hint": "medium"
      }
    ]
  },
  "third_party_evaluations": [
    {
      "source_id": "niccs",
      "level_hint": "associate",
      "url": "https://niccs.cisa.gov/training/catalog/htb",
      "fetched_at": "2026-05-02",
      "summary": "Practical bug-bounty / web-app cert; custom exploit chains, reporting."
    }
  ],
  "sources": [
    {
      "type": "official",
      "url": "https://academy.hackthebox.com/preview/certifications/htb-certified-bug-bounty-hunter"
    },
    {
      "type": "third_party",
      "url": "https://niccs.cisa.gov/training/catalog/htb"
    }
  ],
  "evaluation": {
    "computed_tier": "associate",
    "computed_at": "2026-05-02T14:04:04Z",
    "computed_by_skill": "evaluate-roadmap-3-personas@1",
    "rationale": "All three personas agree at this tier; rationale reflects consensus.",
    "persona_scores": {
      "hiroshi-tanaka": {
        "tier": "associate",
        "rationale": "Auto-derived from third-party evaluations (associate); pending differentiated human persona review."
      },
      "maria-okonkwo": {
        "tier": "associate",
        "rationale": "Auto-derived from third-party evaluations (associate); pending differentiated human persona review."
      },
      "alex-novak": {
        "tier": "associate",
        "rationale": "Auto-derived from third-party evaluations (associate); pending differentiated human persona review."
      }
    }
  },
  "schema_version": 1
}
